{
  "agent": "transportation",
  "status": "complete",
  "data": {
    "days": [
      {
        "day": 2,
        "date": "2026-02-21",
        "location": "Test City 2",
        "location_change": {
          "from_base": "Test City",
          "from_local": "测试城市",
          "to_base": "Test City 2",
          "to_local": "测试城市2",
          "name_base": "Test City to Test City 2",
          "name_local": "测试城市 → 测试城市2",
          "type_base": "High-speed train",
          "type_local": "高铁",
          "departure_time": "08:30",
          "arrival_time": "11:45",
          "cost": 90,
          "currency_local": "CNY",
          "cost_type_base": "Second class seat",
          "cost_type_local": "二等座",
          "company_base": "China Railway",
          "company_local": "中国铁路",
          "route_number": "G8601",
          "departure_point_base": "Test City Station",
          "departure_point_local": "测试城市站",
          "arrival_point_base": "Test City 2 Station",
          "arrival_point_local": "测试城市2站",
          "status_base": "Not yet booked",
          "status_local": "尚未预订",
          "notes_base": "Book 2 weeks in advance for discount",
          "notes_local": "提前两周预订可享折扣"
        }
      }
    ]
  },
  "notes": ""
}
